doc_id,text,publication_date
document_141157.html,"[Discorso in Senato in risposta alle interpellanze sulla politica estera]. numerose interpellanze ed interrogazioni sono state rivolte al Governo da Membri di questa Camera in ordine ai massimi problemi internazionali. Sono stati richiamati la visita a Washington e New York del Presidente del Consiglio[1] e mia[2], i compiti attuali dell’Alleanza Atlantica[3], lo sviluppo della Comunità Europea[4], il progresso delle iniziative di distensione in Europa, lo stato attuale della crisi nel Medio Oriente, i nuovi aspetti di quella da molti anni in atto in Indocina, ed altri punti minori.",1973
document_141054.html,Intervento al Consiglio ministeriale della Cee sulle relazioni con l’America Latina. è motivo di viva soddisfazione per il mio Governo constatare l’impegno messo dalla Commissione e dagli altri Paesi membri nel dar seguito alle proposte a suo tempo avanzate nel memorandum italiano sui rapporti fra la CEE[2] e l’America Latina.,1973
document_141015.html,"Al di là di una mediocre polemica. Il Sen. Fada[1], di recente uscito dall’anonimato in virtù della funzione che si è assunta di punta di diamante nella polemica pre-congressuale, ha rivolto all’on. Moro, più volte, la critica di pronunciare discorsi vuoti, privi cioè di indicazioni politiche, o addirittura fatui.",1973
document_132221.html,"Discorso tenuto alla Fiera Internazionale dell’Agricoltura di Verona . Questa fiera di Verona, collocata in una città ricca di tradizioni culturali, di memorie gloriose, di bellezze artistiche, ma anche di geniali e fortunate iniziative economiche e di grandi possibilità di sviluppo, è essa stessa un segno, uno dei segni, della vitalità e della capacità realizzatrice del popolo italiano. Il nostro Paese è appena uscito, in forza di una responsabile visione delle necessità dell'ora e di una spontanea disciplina sociale, da una grave crisi economica e sta per riprendere la via dello sviluppo. È apparsa evidente ancora una volta la somma delle virtù morali e civili del nostro popolo, quelle stesse che hanno consentito di affrontare le grandi prove e le difficili vicende della nostra tormentata storia nazionale. È apparsa evidente ancora una volta la ricchezza di capacità imprenditoriali, di genialità creatrice, di risorse intellettuali e tecniche, di forza di lavoro, per la quale il nostro Paese ha potuto allinearsi in civile competizione, accanto alle più grandi e prospere nazioni del mondo ed inserirsi senza umilianti disparità ed anzi con successo nell'ambito della Comunità economica europea. Il volto dell'Italia è cambiato mediante l'emergere di, talvolta insospettate, risorse e nell'atmosfera stimolatrice che le nostre libere istituzioni hanno creato. ",1968
document_132307.html,"Resoconto del discorso tenuto in Puglia in occasione della campagna elettorale . Il presidente del Consiglio, on. Aldo Moro, parlando in Puglia nel suo collegio elettorale, ha osservato che lo sviluppo economico del paese, nel quale si inquadra la rinascita del Mezzogiorno, è legato ad un quadro politico quale è quello che si è andato configurando in questi anni e che trova la sua espressione nel programma adottato durante la passata legislatura. ",1968
document_142022.html,"[Sugli avvenimenti in Grecia e sul vertice di Copenaghen] . Onorevole Presidente[1], onorevoli colleghi, non è la prima volta che il Parlamento italiano leva la sua voce per esprimere profonda amarezza e preoccupazione per la grave menomazione della libertà dell’amico popolo greco. Il Governo, il quale non può che essere all’unisono con il Parlamento ed il Paese, pur rispettoso del principio del non intervento, riflette, per una insopprimibile ragione morale, questi sentimenti. Che per tanti anni un tale stato di cose sia stato ripreso in esame nel Parlamento e giudicato allo stesso modo, sta a dimostrare quanto grave sia, prolungandosi nel tempo, la situazione greca.",1978
document_141162.html,"[Brindisi alla colazione offerta ai capi delle rappresentanze diplomatiche]. Eccellenze,è per me motivo di viva e sincera soddisfazione vedere qui riuniti tutti i Capi Missione dei Paesi accreditati presso il Governo italiano. Oltre al piacere di un rinnovato contatto personale con tutti loro, mi si offre così la gradita possibilità di rivolgere, per loro tramite, il più cordiale saluto ai Governi ed ai popoli che essi così degnamente rappresentano e con i quali l’Italia ha rapporti di amicizia e di collaborazione.",1973
document_142209.html,[Alla Dc di Gravina e Andria]. Parlando adAndria Moro ha dato una risposta chiara e precisa alle preoccupazioni circa i tentativi in atto «anche ai livelli locali» di «forzare certe soluzioni politiche» che in pratica si traducono in astiosi atteggiamenti punitivi verso la Democrazia cristiana.,1978
document_132057.html,"Discorso tenuto al IV Congresso dell’Ente nazionale casse rurali e artigiane . Ho accolto volentieri l’invito del Vostro Presidente[1] di presenziare a questo Convegno Nazionale perché alla naturale simpatia che accosta alle più piccole, ma non per questo meno operose, aziende di credito, si aggiunge la possibilità di un desiderato incontro con il Movimento delle Casse Rurali e Artigiane d’Italia.",1968
document_141132.html,"Brindisi in occasione del pranzo offerto in onore del ministro degli Esteri giapponese Aichi. tengo ad esprimere a Lei ed al Governo giapponese il più sentito ringraziamento per la cordialità dell’accoglienza che mi è stata riservata nel Vostro nobile Paese e mi auguro che a questa visita faccia seguito una Sua, graditissima, in Italia. Noi apprezziamo infatti grandemente incontri come questi, al fine di studiare insieme gli importanti problemi che i nostri due Paesi sono chiamati ad affrontare.",1973
document_110097.html,"Il popolo italiano. Nei giorni scorsi i servizi pubblici ed il lavoro delle industrie nell’Italia settentrionale sono stati turbati da uno sciopero di vastissime proporzioni e di lunga durata. La stessa Radio-Roma ammette, benché a denti stretti, la cosa, ne riconosce la serietà, non riesce neppure a dissimularne il significato politico, in vista del quale va minacciando le più severe sanzioni contro i colpevoli. Minaccia, evidentemente, impotente, se, rinunciando a tradursi, come potrebbe, nei fatti, vien usata in definitiva come una qualunque blandizia, per ridurre alla ragione l’avversario potente.",1946
document_131011.html,"[Convegno sull’assistenza sociale]. Ringrazio molto l'on. Dal Canton per le sue gentili parole. Ringrazio tutte le autorità e tutti gli amici intervenuti a questo convegno, al quale mi sento veramente onorato e lieto di partecipare.",1963
document_141124.html,"Risposta al brindisi del ministro degli Esteri messicano Carrillo Flores. le sono profondamente grato, anche a nome dei miei collaboratori, per le espressioni tanto sincere ed amichevoli che Ella, nel darci il benvenuto in Messico, ha voluto avere per l’Italia, per me personalmente e per il lavoro che ci accingiamo a compiere.",1973
document_141251.html,"[Brindisi per la nascita dell’Istituto Universitario Europeo]. con le parole da me pronunciate poco fa a Palazzo Vecchio[1], ho già rivolto a tutti i presenti l’espressione della mia più viva soddisfazione per questa occasione, che vede sorgere in Firenze l’Istituto Universitario Europeo.",1973
document_131070.html,"[Che cosa chiede la DC a Pietro Nenni]. Il recente Consiglio Nazionale della D.C.[1] ha certamente giustificato l’attesa e l’interessamento dell’opinione pubblica per l’importanza dei temi trattati e per il tono elevato e costruttivo del dibattito. Si trattava infatti di fare il punto sui risultati elettorali[2], d’individuare gli orientamenti dell’opinione pubblica, di chiarire e valutare le posizioni assunte dai partiti nella soluzione dei problemi del governo locale, di misurare alla stregua di questo complesso di dati la validità e le prospettive della formula di Governo[3], d’indicare infine gli obiettivi politici di fondo verso i quali si muove il maggior partito italiano.",1963
document_121196.html,"Il programma della DC. La DC, dopo quasi due anni di intensa attività parlamentare e di governo, si presenta al giudizio del popolo con la consapevolezza di avere adempiuto interamente al suo compito e con un programma di azione, relativamente ai grandi problemi sociali e politici del momento, in tutto rispondente ai suoi ideali ed alla caratteristica ed insostituibile funzione che essa è chiamata ad assolvere nella vita politica italiana.",1951
document_132282.html,"Discorso tenuto a Roma in occasione del Consiglio nazionale dell'Unione nazionale dei comuni ed enti montani . desidero ringraziare innanzitutto l’on. Enrico Ghio, che mi ha voluto partecipe di questi vostri lavori, per le parole così belle, confortanti e commoventi che ha pronunciato nei miei confronti, e poi voi tutti per l’accoglienza amichevole che mi avete riservato.",1968
document_132177.html,"Discorso tenuto a Bari in occasione della 30° Fiera del Levante. Signor sindaco, signor presidente della Fiera del Levante[1], ",1968
document_141007.html,"[Scomporre, per ricomporre: discorso al Consiglio nazionale della Dc]. Questo Consiglio Nazionale è innanzi tutto chiamato ad esprimere un giudizio sulla formazione del Governo organico di centro-sinistra, presieduto dall’on. Rumor[1].",1973
document_110112.html,"Problemi dell’università italiana. Tra i problemi che s’impongono alla nostra attenzione in questo momento, particolarmente importante, è quello dell’Università.",1946
document_141126.html,"[Intervento al Consiglio Ministeriale della Cee sui rapporti con l’America Latina]. nella seduta del 17 ottobre 1969 la Delegazione italiana aveva avuto l’onore di manifestare al Consiglio la viva soddisfazione del suo Governo per l’impegno preso dalla Commissione e dagli altri Paesi membri nel dar seguito alle proposte avanzate con il memorandum italiano del 5 novembre 1968 sui rapporti tra Cee[2] ed America Latina. Nella stessa seduta il Consiglio, con una precisa manifestazione di volontà politica, esprimeva in una apposita “dichiarazione” la sua piena coscienza della “grande importanza politica ed economica che riveste lo sviluppo di buone relazioni tra le Comunità ed i Paesi dell’America Latina” incaricando i Rappresentanti Permanenti di proseguire lo studio delle misure più appropriate al raggiungimento dello scopo, facendogli rapporto nei termini più ravvicinati possibili.",1973
document_142166.html,"[Discorso elettorale ad Ancona]. « Queste elezioni non sono caratterizzate dall’esistenza di una precisa formula politica della quale si chieda la continuazione con gli opportuni aggiustamenti. A parte la nebbia che c’è intorno al cosiddetto governo di emergenza, alla sua possibile configurazione, alla sua concreta realizzabilità, si deve riconoscere che la messa in crisi della politica di centrosinistra preclude precise indicazioni positive. Resta però fermo almeno il principio della DC indiscutibile delle collaborazioni democratiche le quali sono, prima che una necessità, un valore da non disperdere anche nella confusa situazione che caratterizza queste elezioni anticipate ».",1978
document_141052.html,"[In vista dell’incontro con Mitchell Sharp]. […] Dopo la presentazione alle autorità canadesi l’on. Moro ha fatto una dichiarazione alla stampa nella quale, affermato che la sua visita a Ottawa ha soprattutto lo scopo di riaffermare i legami di amicizia che uniscono intimamente l’Italia al Canada, ha così proseguito:",1973
document_141257.html,"[Intervento al Consiglio ministeriale di Lussemburgo]. Si è aperta questa mattina a palazzo Kirchberg, a Lussemburgo, la riunione dei ministri degli Esteri della CEE[1]. Partecipano anche i ministri dei quattro paesi che entreranno alla CEE l’anno prossimo. La riunione è preparatoria della conferenza che riunirà a Parigi, il 19, 20 e 21 ottobre, i capi di Stato (Francia) e di Governo dei Paesi della Comunità europea. Nel suo intervento l’on. Moro, che guida la delegazione italiana […], ha insistito affinché dal vertice risultino impegni concreti in tre campi: la politica regionale, «che nel processo di integrazione economico-monetaria deve diventare l’elemento qualificante dello sviluppo economico generale dei paesi della comunità», la politica culturale, «il cui sviluppo dovrebbe essere preso in maniera globale», la politica sociale, «indispensabile se si vuol dare significato e contenuto alla nozione di cittadinanza europea».",1973
document_121257.html,"[Sulla vigilanza e il controllo della stampa destinata all’infanzia e alla adolescenza]. Signor[1] Presidente[2], onorevoli colleghi, mi rendo conto che la discussione su questa proposta di legge deve assumere per forza di cose un carattere appassionato e vivace. Indubbiamente la materia della quale ci occupiamo è del più alto interesse. Si tratta dei diritti di stampa, si tratta di una conquista della restaurata democrazia in Italia ed è quindi del tutto comprensibile che da tante parti e con tanto calore, a seconda dei rispettivi punti di vista, si prenda posizione su questo tema. Egualmente di alto ed appassionato interesse è l’oggetto in relazione al quale si propone questa discussione sulla libertà della stampa, cioè la tutela morale dell’infanzia e dell’adolescenza. È quindi giustificato che fino a questo momento il dibattito nella nostra Assemblea e nel paese abbia avuto un tono di notevole vivacità e che si sia manifestata una sensibile divergenza di punti di vista e di impostazioni di principio. Nondimeno io credo che nell’esame di questa proposta di legge si debba procedere, se non freddamente, che sarebbe cosa impossibile, almeno con la maggiore serenità, e, vorrei dire, spregiudicatezza. Al di là delle posizioni appassionate, polemiche, dobbiamo pure ad un certo punto andare al nucleo dei problemi e considerare questi problemi serenamente, per quello che essi sono, e le soluzioni proposte da questa legge anch’esse con serenità, quali sono in essenza, e non già quali appaiono nelle esterne formulazioni.",1951
document_122017.html,"Montecitorio. I bilanci del Tesoro e delle Finanze. Questa settimana parlamentare, più breve del solito a causa della incidenza della celebrazione del 25 aprile, ha visto iniziarsi una discussione di estrema importanza e di grande attualità, quella sui bilanci del Tesoro e delle Finanze, l’esame dei quali implica una considerazione d’insieme di tutta la vita economica e finanziaria del paese. Di questa valutazione non si è avuto ancora il compiuto svolgimento parlamentare, che occuperà invece presumibilmente le due prossime settimane dei lavori della Camera. Se ne è avuto però l’inizio con l’ampia e documentata relazione del Ministro Pella[1] sulla situazione economica del Paese, relazione che costituisce la base della discussione parlamentare che appunto sta per avere inizio. Ed è proprio per dare più respiro ed insieme più concretezza a questa valutazione, che il dibattito sul bilancio del Tesoro e su quello delle Finanze è stato rinviato alla prossima settimana.",1958
document_141100.html,"[Discorso a Bari in vista delle amministrative]. Il Ministro degli Esteri, on. Aldo Moro, per la sua campagna elettorale ha ricordato come l’Italia sia appassionatamente impegnata in un’opera di pace. La sospingono in questo senso il suo spirito democratico, la sua vocazione umana, una intelligente valutazione dei suoi interessi. Per tutte queste ragioni si deve non solo evitare il grande scontro che incenerirebbe il mondo, ma anche i conflitti limitati, ma anche le tensioni semplicemente minacciose. Chi si può stupire dunque che l’Italia guardi al Medio Oriente con preoccupata attenzione e che non trascuri ogni possibile ed utile iniziativa pacificatrice?",1973
document_141050.html,"[Discorso alla XXIV sessione dell’Assemblea Generale delle Nazioni Unite]. mi consenta anzitutto di dirLe la soddisfazione della Delegazione italiana nel vederLa presiedere questa Assemblea. Noi salutiamo in Lei, Rappresentante di una Repubblica di antiche tradizioni, l’interprete della volontà e delle aspirazioni di un continente[2] ricco di giovani energie destinate ad imprimere nuovo impulso allo sviluppo della comunità internazionale: un continente cui l’Italia si sente legata da vincoli di amicizia e di collaborazione.",1973
document_131073.html,"[Il discorso di Cagliari]. Il segretario politico della Democrazia Cristiana, on. Aldo Moro, aprendo la campagna elettorale per il rinnovo del Consiglio regionale sardo[1], ha espresso la solidarietà di tutto il Partito agli amici impegnati in una difficile battaglia che riguarda – ha detto – la Sardegna, ma ha notevoli riflessi sul piano nazionale. Ogni consultazione implica sempre, del resto, una serie di valutazioni politiche anche quando si svolge sul terreno amministrativo, perché mette in movimento il corpo elettorale e fa appello alla sua volontà sovrana; ciò tanto più quando la scelta dei cittadini, come in questa occasione, investe l’avvenire di un’intera Regione.",1963
document_121204.html,"[Un discorso dell’on. Moro a Bari. La posizione dell’Italia di fronte al problema della pace]. L’on. Prof. Aldo Moro, Sottosegretario agli Affari esteri, ha tenuto ieri mattina a Bari, nella sala Giuseppina, l’annunciato discorso sul tema: L’attuale momento politico italiano. Un pubblico foltissimo e numerose autorità hanno seguito l’esposizione, profonda e serenamente realistica, che egli ha fatto dei problemi e degli aspetti della nostra vita politica sotto il profilo interno e sotto quello internazionale: non un comizio, dunque, come spesso ci accade di sentire da alcuni uomini politici abituati a sollecitare facili applausi e da uditori organizzati ma, interpretazione rigorosa di fatti e di situazioni, responsabilità di giudizi e di valutazione quali si convengono non soltanto a un uomo di governo ma a un consapevole esponente di partito che intenda portare concreto contributo ai problemi del proprio paese. E fra il pubblico vi erano ascoltatori di varia posizione politica, che han seguito con non minore interesse degli altri ed hanno anch’essi alla fine applaudito. ",1951
document_141174.html,Intervento al Consiglio ministeriale della Cee. Desidero ringraziare la delegazione francese per il contributo concreto dato alla discussione sui problemi della partecipazione finanziaria dei Paesi candidati alle spese della Comunità[1] con la proposta messa sul tavolo dei Rappresentanti Permanenti alcuni giorni fa.,1973
document_132253.html,"Resoconto del discorso tenuto a Vicenza in occasione dell'inaugurazione della Mostra nazionale dell'oreficeria e dell'argenteria . A Vicenza, inaugurando la mostra nazionale dell’oreficeria e dell’argenteria, il presidente del Consiglio on. Aldo Moro, in risposta all’indirizzo di saluto rivoltogli dal sindaco dr. Sala[1] e dal presidente della Fiera on. Breganze[2], ha manifestato la sua gratitudine per la cordiale accoglienza ricevuta ed ha reso omaggio alla città.",1968
document_110133.html,"[Circolare, 27 dicembre 1944]. Chiamato dall’Em.mo Cardinale Luigi Lavitrano[1] a reggere il movimento Laureati Cattolici in questo difficilissimo momento della vita nazionale e internazionale, intraprendo il mio lavoro con piena coscienza degli ostacoli da superare, per ridare alla Sezione l’efficienza compromessa dalla dura vicenda bellica e fare anzi che essa fiorisca più e meglio.",1946
document_132032.html,"Intervento al Senato al termine del dibattito sul bilancio dello Stato . Onorevole Presidente[1], onorevoli senatori, ",1968
document_132143.html,"Replica al Senato al dibattito sulla fiducia al III governo Moro. Credo di poter rispondere brevemente al termine di questo interessante dibattito, perché le posizioni espresse nel mio ampio discorso di presentazione possono essere, a mio avviso, confermate pur dopo avere attentamente valutate le riserve e le polemiche qui manifestate dalle opposizioni. Ringrazio tutti per i loro interventi con i quali hanno, comunque, contribuito a chiarire l'attuale momento politico. Ringrazio in modo tutto particolare i senatori Viglianesi, Cenini, Giraudo, Vittorelli, Bolettieri i quali hanno dato, a nome della maggioranza, la loro cordiale adesione al nuovo Governo in vista dei suoi obiettivi politici e del suo programma. Molti interventi sono stati indirizzati ad esaminare il modo secondo il quale la crisi si è prodotta, si è svolta, si è al fine conclusa. Ma in verità non sono emersi elementi nuovi, tali da mettere in forse la ricostruzione obiettiva che avevo dato degli avvenimenti. lo non ho nascosto le difficoltà insorte, quando ci si è trovati di fronte al radicale riesame della situazione che noi stessi avevamo voluto, al di là del proposito iniziale, avendo colto nella maggioranza un disagio che meritava di essere approfondito e che si era espresso in voti parlamentari contraddittori. È merito dei partiti di aver affrontato in modo radicale, proprio a fini di chiarezza e d'impegno, il problema di un nuovo e costruttivo rapporto nell'ambito della coalizione. Ripeto che ha un valore positivo proprio il fatto che difficoltà, anche gravi, siano state affrontate e che si sia giunti ad una soluzione positiva della crisi di Governo. ",1968
document_141263.html,"[Discorso a Bari in vista delle elezioni]. Parlando a Bari il Ministro degli Affari Esteri, on. Aldo Moro, ha detto che il dialogo con gli elettori, dopo tante polemiche, fa emergere la fisionomia genuina della Democrazia Cristiana e ripropone il partito di maggioranza relativa come punto essenziale di riferimento nella vita politica italiana. L’autenticità della Democrazia Cristiana è, allo stesso modo che la sua forza, condizione perché essa possa assolvere al suo compito storico. Le esigenze della vita politica italiana rimangono inalterate e non possono essere soddisfatte, nella presente condizione storica, se non con la forza, l’autorità, la sensibilità umana e sociale della Democrazia Cristiana. È solo con essa in posizione determinante che il Paese può sottrarsi alla stretta del Partito comunista pur nella integrità del gioco politico e parlamentare, contrapponendo a quella comunista non il rozzo impedimento della reazione politica e della conservazione sociale, ma una prospettiva di progresso e di giustizia nella libertà. La pace politica in Italia, come presupposto dell’emergere ordinato di una società nuova, è legata al primato della Democrazia Cristiana ed al formarsi di un serio e coerente schieramento in armonia con la spinta della storia, che è possibile dominare e valorizzare nell’ordine democratico.",1973
document_121145.html,Costituzione e difesa della civiltà cristiana. Già qualcuno dei problemi costituzionali che più vivamente interessano i cattolici è stato affrontato dall’Assemblea costituente. Altri verranno in discussione tra poco.,1951
document_121151.html,"Osservatorio 3 (luglio-agosto 1947). Nel numero di giugno di «Idea»[1], la bella rivista diretta da Mons. Barbieri[2], Ulisse Pucci[3] fa un’acuta analisi critica della posizione dei ceti medi, ricavando conclusioni interessanti circa lo schieramento delle forze politiche in questo secondo dopoguerra.",1951
document_141302.html,"[Lettera ai candidati morotei]. desidero ringraziarti per avere accettato di rappresentare nella tua Provincia il nostro Gruppo nella prima tornata di elezioni in vista del Congresso Nazionale della Democrazia Cristiana. L’essere noi in minoranza comporta per gli amici una posizione di grande distacco. È perciò tanto più meritoria la tua adesione, con la quale intendi rendere un disinteressato servizio al Partito.",1973
document_110153.html,"Per la Giornata Universitaria. Anche quest’anno il 18 marzo sarà tenuta la giornata per l’Università Cattolica del S. Cuore. Tutta l’Azione Cattolica Italiana è impegnata nel promuovere opportune iniziative, che facciano conoscere di più questa grande opera ed assicurino ad essa mezzi adeguati per continuare le sue attività feconde di bene.",1946
document_142158.html," [Ai quadri della Coldiretti] .  Amici coltivatori diretti , sono lieto di trovarmi ancora una volta tra voi secondo una consuetudine consolidata e che mi è cara. Conosco ed apprezzo le vostre qualità umane, la serietà, la semplicità, l’equilibrio e l’attaccamento al lavoro. Conosco ed apprezzo le vostre virtù civiche. Nel corso del trentennio seguito alla seconda guerra mondiale voi avete contribuito grandemente, oltre che allo sviluppo economico ed al progresso sociale delle campagne, alla stabilità delle istituzioni ed all’arricchimento della vita democratica in Italia . E siete stati, per il Governo, un punto costante di riferimento. Voi avete condotto un’azione di giusto stimolo nei confronti del potere politico, al fine di sanare situazioni di disagio, assicurare benessere e degne condizioni di vita al mondo rurale, realizzare la graduale perequazione con altri gruppi sociali, ammodernare l’agricoltura, inserire vantaggiosamente la nostra economia nel contesto europeo. ",1978
document_132173.html,"Discorso tenuto a Trento in occasione del 50° anniversario della morte di Cesare Battisti . Con profonda emozione ci troviamo oggi a pronunziare il nome di Cesare Battisti in questa città di Trento, che gli dette i natali nel febbraio 1875 e lo vide morire nel luglio 1916, con la dignità di chi scorge ancora la Vita oltre la morte. «Io vado incontro alla mia sorte con animo sereno e tranquillo»: sono parole che si leggono nell'ultima lettera di Battisti al fratello. Degli Eroi - e dello stesso Battisti, dunque - si preferirebbe quasi di non parlare. ",1968
