doc_id,text,publication_date
document_110152.html,"Ragion di essere. In questi ultimi mesi qualcuno ha dubitato che l’Azione Cattolica abbia ancora una sua ragion d’essere, considerato che sono ormai in atto libere associazioni politiche dei cattolici italiani. Già qualcuno pensava negli ultimi venti anni che l’Azione Cattolica fosse appunto un surrogato di organismi politici che non potevano sussistere[1]. E l’errore continua ancor oggi. Ma esso va subito fugato, perché disconosce la profonda natura dell’Azione Cattolica e ne compromette le possibilità di vita. Un chiarimento intorno alla nostra ragion di essere è poi tanto più urgente in quanto questo svisamento delle finalità delle nostre organizzazioni si traduce purtroppo in molti casi, sotto la pressione di immediate e assorbenti esigenze di ordine politico, in un impoverimento della nostra azione.",1946
document_132154.html,"Dichiarazione per «La Stampa» di Torino . Il recente accordo intervenuto tra le autorità sovietiche e la FIAT per la fornitura di un complesso di attrezzature e di assistenza tecnica relativa ad un nuovo impianto automobilistico nell’URSS è stato registrato da parte governativa con interesse e con favore. Esso si inquadra, infatti, in quell’accordo di cooperazione economica e scientifico-tecnica firmato il 23 aprile a Roma, in occasione della visita del Ministro Gromiko[1], al quale il Governo italiano guarda come a una base di fruttuosa e costruttiva collaborazione tra i due paesi. Di tale accordo le intese intervenute tra la Fiat e le organizzazioni sovietiche costituiscono la prima manifestazione di alta rilevanza operativa.",1968
document_142237.html,"Un’Europa a due velocità . Cattive notizie, dunque, per l’Europa. Benché il dibattito in corso sulla situazione italiana abbia limitato la risonanza della decisione britannica relativamente alle elezioni del Parlamento europeo[1], non è sfuggito certamente che un evento importante, lungamente atteso ed apparso, infine, sicuro ed imminente, stava per uscire dall’attualità politica, per ridiventare in qualche modo una speranza per il domani. ",1978
document_142136.html," [Al Consiglio europeo ] .  La decisione di eleggere il Parlamento europeo a suffragio universale diretto, nella primavera del 1978, tra maggio e giugno è « una decisione fondamentale, e da molti anni attesa, per la costruzione di una Europa unita e democratica. Essa testimonia dell’impegno europeista di ciascuno dei nove governi dei paesi membri della Comunità ». ",1978
document_110070.html,"Problemi di vita. Negli sviluppi della storia di ogni giorno, di cui siamo spettatori interessati ed attori efficienti ad un tempo, siamo spesso, troppo spesso ancora abituati a vedere soltanto problemi di vita, che lasciano indifferente la nostra anima cristiana, quasi che essi restassero in una sfera sola di noi e non c’impegnassero interi. D’altra parte, i problemi propri della universale comunità dei fratelli, in cui siamo, la Chiesa, siamo abituati ancora a considerare come tali, appunto, che impegnano un’altra particolare sfera del nostro io, mentre restano per se stessi del tutto estranei all’altra nostra vibrazione di vita, alla nostra storia di uomini e di cittadini, che siamo inseriti in una Patria e viviamo in questa, e da questa partendo, allarghiamo la nostra visione verso gli orizzonti aperti della vita universale. Mondi appassionati e vibranti entrambi, mondi di dramma e di passione, nei quali le cose che son fuori di noi in apparenza finiamo per sentire propriamente nostre, avvertendo impegnata la nostra personalità, sentendo il nostro io responsabile di tutto questo processo, di questo complicato accavallarsi, risolversi, riproporsi di problemi. Storia tutta, possiamo ben dire, e storia in largo senso umana. Dov’è il punto di contatto fra i due mondi?",1946
document_141266.html,"[Brindisi in onore del ministro degli Esteri svedese Wickman]. Il ministro degli Esteri di Svezia, Krister Wickman[1], ha compiuto il 16 maggio una visita a Roma, durante la quale ha avuto colloqui con il ministro degli Esteri Moro e con il ministro del Tesoro Colombo[2].",1973
document_132110.html,"Brindisi per la colazione a Villa Madama in onore del presidente della Repubblica del Cile Frei . sono molto lieto di indirizzare a lei e alla gentile signora Frei il mio saluto e quello del Governo italiano. È per noi un onore ed un particolare piacere quello di accoglierla nel nostro Paese, prima meta del suo viaggio europeo. Ella visita l'Italia come il più alto magistrato della Repubblica del Cile, a noi così amica e con la quale siamo uniti da tanti saldi legami e vecchie affinità storiche e spirituali. Consideriamo altresì un privilegio salutare in lei lo statista eminente che incarna tante speranze degli uomini di buona volontà. Si parla spesso, nella valutazione delle vicende del Continente americano, di ""esperimento cileno"" e, quando si usa questa espressione, si vuole, implicitamente od esplicitamente, attribuire ad esso un valore esemplare. Si ravvisano, infatti, nell'opera di rinnovamento cui ella presiede una forza vitale ed una capacità d'iniziativa che non sono certo fra i motivi minori di interesse suscitati dalla sua attività di governo. ",1968
document_141039.html,"Responsabilità. Sono stati resi noti alcuni dati relativi ai risultati dei congressi provinciali della Democrazia Cristiana. Crediamo che essi siano suscettibili di sensibili variazioni, tenuto conto delle numerose liste di sinistra e locali, delle quali si dice incerta l’attribuzione. Non vogliamo per parte nostra fare anticipazioni anche perché pure immaginando esatte queste cifre (e non lo sono), il problema politico rimane lo stesso. Per grandi linee la situazione è invariata e quel che conta è la scelta che si è chiamati a fare.",1973
document_110095.html,"Vicolo cieco. Le dichiarazioni del Premier britannico[1] alla Camera dei Comuni danno, per quel che riguarda il nostro paese, interessanti orientamenti, ai quali gl’Italiani faranno bene a prestare l’attenzione dovuta. Nello stato in cui siamo, che è di estrema confusione, ogni spunto dato per rischiarare l’atmosfera pesante e pericolosa ha da essere preso sul serio e reso fecondo, per quanto è possibile, con quella prudenza accorta, accomodante e di larghe vedute che accompagna costantemente la sensibilità politica di un popolo. Ha detto Churchill che, a suo parere, non potrebbe oggi costituirsi in Italia un Governo che, alla pari di quello ora al potere, ottenga obbedienza dalle Forze Armate dello Stato. Ha aggiunto che a Roma certamente la situazione politica del nostro paese verrà chiarita. Le affermazioni riportate meritano una breve analisi.",1946
document_110134.html,"Rapporti tra periferia e centro. Dei rapporti tra centro e periferia si è molto parlato in questi ultimi tempi e non solo per desiderio di richiamare in vita il passato, nel quale fu assai dibattuto il problema del decentramento amministrativo. In realtà la separazione da Roma della nuova Italia democratica, dopo un costume più che ventennale di accentramento politico e amministrativo, determinò un vero disorientamento nella vita italiana in ogni settore, dimostrando come quei rapporti fossero stati impostati in modo non costruttivo e addirittura dannoso, per la funzionalità stessa del centro del paese oltre che per la provincia. Ma questa esperienza, imposta essa pure dalla guerra, non servì tanto a scoprire e denunciare un difetto di organizzazione o forse più di impostazione spirituale, ma fortunatamente, per la spinta di necessità impellenti, ridestò sopite, insospettate energie in ogni ordine di attività e condusse la periferia a guidarsi da sé e, in qualche modo, a bastare a se stessa. Così oggi, in un certo senso, il problema è invertito e, a parte talune ingenue (o interessate) spinte sentimentali verso la capitale, è piuttosto la provincia che fa a meno d’indirizzi, non avverte il bisogno di riflettersi e di controllarsi in un più vasto ambiente, rifiuta, in una parola, di articolarsi con il suo volto nella vita molteplice della nazione. ",1946
document_122042.html,"[Sulla disciplina dei rapporti tra commissioni parlamentari ed assemblea] . Confesso[1] che le prime parole pronunciate dall’onorevole Laconi[2], tendenti a contestare il carattere di richiamo al regolamento a questa discussione, mi hanno impressionato e lasciato perplesso. Senonché, riconsiderando con attenzione la cosa, mi sono convinto che l’unica esatta collocazione della questione è il richiamo al regolamento. Ne dirò le ragioni.",1958
document_110226.html,"Il Movimento Laureati nell’ora attuale. Il nostro incontro si presenta quest’anno particolarmente interessante, in quanto davanti a noi si propone un compito nuovo: riprendere le fila del nostro passato, che furono spezzate dalle vicende della guerra. Dobbiamo stabilire ancora una volta la ragione di essere del nostro Movimento, riconfermare il nostro impegno di lavoro in modo sereno e definitivo.",1946
document_122066.html,"[Sulla soppressione dell’Istituto per le relazioni culturali con l’estero]. Anch’io[1] non posso fare a meno di osservare che sono preoccupato della sorte di queste 27 persone che non possono essere riassunte fra il personale avventizio degli esteri, e credo che sarà compito particolarmente penoso fare la scelta di queste dieci unità che a norma dell’articolo 3 saranno inquadrate in detto personale. Io mi domando se non sia possibile inquadrare tutto il personale, e, ove questo non fosse attuabile, in linea subordinata, portare almeno le unità da assumere da dieci alla metà del numero dei funzionari dell’I.R.C.E.[2]",1958
document_132108.html,"Discorso tenuto alla Confederazione nazionale dei dirigenti di azienda. Prendo la parola soltanto per esprimere la mia riconoscenza per le accoglienze così cordiali ed amichevoli che mi sono state riservate, per ringraziare il Presidente, l’amico Togni, per la cortesia affettuosa con la quale ha voluto salutarmi.",1968
document_122026.html,"[Sulla disciplina dei rapporti tra commissioni parlamentari ed assemblea] . Mi sembra[1] che, pur lasciando impregiudicata la questione sollevata dall’onorevole Laconi[2], la quale potrebbe divenire oggetto di discussione in sede di Giunta del regolamento (allo scopo di precisare la portata dell’articolo 85, al quale credo che, in linea di principio, noi dovremmo far ricorso più spesso per accelerare i nostri lavori), in questa situazione particolare tutti i colleghi concordino sull’opportunità di esaurire la discussione della legge al più presto e nel ritenere che la sede più opportuna, per il suo esame, datone il carattere eminentemente tecnico, sia la Commissione. ",1958
document_110037.html,"Richiamo alla preghiera. In una recente lettera indirizzata al Cardinale Segretario di Stato, il S. Padre invita con accorata parola i fedeli di tutto il mondo a pregare intensamente, in questo maggio consacrato al culto della Madonna, per la pace del mondo[1].",1946
document_110076.html,"Responsabilità dell’Universitario. Gli anni passati nell’Università sono intesi per lo più come tempo di preparazione e di attesa, durante il quale la personalità viene formandosi di fronte alle esigenze che la vita le propone. Questo è certamente vero, come vedremo tra poco; non è nel vero invece il sorgere nei giovani meno sensibili ed attenti di una mentalità che l’Università presenta come un’oasi di riposo, una tranquilla attesa di una vita grave di responsabilità, di prove e di dolori, che verrà purtroppo molto presto e che non è prudente avvicinare ancora con un richiamo continuo alle responsabilità che questo tempo di attesa, per essere di preparazione e non di dissipazione, a sua volta comporta. Eppure è chiaro che la responsabilità per l’avvenire e quella per il presente si implicano a vicenda, che cioè, quale è oggi la vita del giovane, seria e pensosa, ovvero dissipata e dimentica, tale sarà il domani del professionista e dell’uomo; che in ragione del come e del quanto si sarà costruito oggi, si potrà svolgere il lavoro di domani.",1946
document_121012.html,"[La libertà personale. I principi dei rapporti civili]. [L’onorevole Moro] Rileva[1] che l’onorevole Lombardi[2] ha delle idee singolari sui rapporti tra Costituzione e leggi speciali. Qualche giorno fa, ad esempio, egli chiedeva che fossero promulgati i Codici prima della Costituzione, invece è il Codice che deve prendere ispirazione dalla Costituzione e quindi anche il Codice penale deve seguire alla Costituzione. La funzione della Costituzione è appunto quella di determinare il supremo indirizzo della legislazione. Perché rinviare alla legge la determinazione di una materia come questa, che tocca così profondamente la libertà individuale? È proprio la Costituzione che deve garantirla ponendo i limiti alla legge penale futura. Quanto ai limiti di tempo stabiliti perché l’autorità di pubblica sicurezza presenti denuncia all’autorità giudiziaria, si potranno anche discutere, ma pensa che debbano essere mantenuti per una ragione di fatto. ",1951
document_141103.html,"[Intervento al vertice a Lussemburgo sull’allargamento della Cee]. […] In un suo intervento, il ministro degli Esteri on. Moro, che guida la delegazione italiana, della quale facevano parte il ministro dell’agricoltura Natali[1] e il sottosegretario agli esteri Pedini[2], ha detto che l’ampliamento della Comunità[3] poneva il problema dei rapporti con i paesi dell’EFTA[4], che per vari motivi non aderirono alla Comunità.",1973
document_110149.html,"La Sinistra cristiana. La sconfessione del Partito della sinistra cristiana ha ridestato problemi che, innegabilmente, agitano, in Italia e nel mondo, la coscienza cattolica contemporanea. Non si può negare che una grandissima incertezza sussisteva in molti spiriti pensosi, prima che intervenisse, netta e severa, questa parola chiarificatrice. Non si può dubitare neppure che, per la delicatezza dei riflessi di ordine psicologico e morale, questa condanna sia stata meditata con quella serena prudenza che caratterizza la condanna della Chiesa e voluta per ragioni di bene.",1946
document_142152.html," [In occasione dell’incontro con Sadat ] .  Il Presidente del Consiglio ha introdotto i colloqui con un « caloroso indirizzo di saluto » al Presidente Sadat  [1]  , definito « autentico capo di un popolo ». Moro ha messo in risalto le iniziative del Presidente egiziano che hanno « spianato la strada verso un assetto pacifico in Medio Oriente ». Ma per quanto si sia rivelata saggia la « politica dei piccoli passi » seguita da Sadat , essa, ha precisato Moro, non può sostituire un regolamento globale. È perciò necessario che ci si avvii verso una soluzione complessiva dei problemi mediorientali da ricercarsi nella conferenza di pace di Ginevra , che deve essere « ben preparata » ed alla quale devono partecipare tutte le parti interessate. ",1978
document_110034.html,"Convegno d’Arte. Per i giorni, 19, 20 e 21 di aprile è indetto in Firenze il VI Convegno d’Arte, organizzato quest’anno in fraterna affettuosa collaborazione con gli amici della Gioventù di Azione Cattolica. Vi sono invitati i nostri studenti di scuole superiori d’arte e quanti, fra i nostri organizzati, si interessano di problemi artistici. Il Convegno sarà caratterizzato, come tutte le nostre adunanze, dallo spirito di fraternità determinato dai comuni ideali di vita e dal comune lavoro per la ricerca di una verità che si vuole conquistare insieme; anche qui la preghiera darà il tono alle nostre giornate.",1946
document_132258.html,"Resoconto del discorso tenuto a Villadossola in occasione dell'inaugurazione del monumento al Lavoro . Il presidente del Consiglio, on. Aldo Moro, parlando a Villadossola per l’inaugurazione del monumento al lavoro, ha esaltato il valore umano e sociale dell’attività lavorativa ed il contributo che essa dà al progresso economico e sociale della nazione. L’onorevole Moro, ricordando la dedizione, il sacrificio ed il rischio che il lavoro comporta e rivolgendosi ai numerosi lavoratori presenti, i quali hanno validamente contribuito alla profonda trasformazione ed evoluzione della zona, ha detto di comprendere pienamente quali sono le esigenze che il mondo del lavoro prospetta e che è compito della classe politica, in armonia con la stessa società civile, soddisfare. Egli ha fatto riferimento all’attesa di sicurezza circa il proprio posto di lavoro, alla pressante richiesta che il lavoro sia garantito e cioè che sia data in una società democratica la possibilità di vivere non comodamente, ma appunto lavorando e sacrificandosi, accettando di pagare il prezzo di pesante impegno individuale che la persona, la famiglia e la società richiedono per la propria vita ed il proprio sviluppo. Parimenti è ansiosamente attesa una condizione di sicurezza sociale che renda tranquillo il lavoratore di fronte ad ogni sfortunata evenienza ed al suo domani. ",1968
document_141160.html,"[Brindisi all’ambasciata italiana di Copenaghen]. La ringrazio, Signor Ministro[1] e caro Collega, per avermi fatto l’onore d’accogliere l’invito a venire nella nostra Ambasciata. Io oso sperare che Ella vorrà, il più presto possibile, visitare l’Italia, dove potremo continuare, in un incontro anch’esso utile e gradevole, l’interessante scambio di informazioni e valutazioni che abbiamo svolto a Copenaghen ieri ed oggi.",1973
document_132309.html,"Articolo per «Oggi» e il «Popolo»: invito ai giovani per un dialogo costruttivo. Tra pochi giorni voteremo, ma questo non è un appello elettorale, non è un rendiconto e neppure un programma: è un esame di coscienza che io faccio soprattutto per me, e che forse può offrire un pretesto anche alla vostra meditazione. lo so che le scelte sono già fatte, e sono lieto perché ognuno ha potuto serenamente esporre le sue idee e criticare quelle degli avversari, dire il suo rammarico o la sua speranza. Ci sono, nel mondo, tanti segni di rivolta e di protesta, in molti paesi la politica accende la violenza e finisce sulle piazze e nei tribunali. Deve essere un motivo di orgoglio per tutti constatare che in Italia non si sono ristretti i confini della libertà, che c'è un rispetto per ogni voce e spazio per ogni iniziativa. Tutte le forze sono rappresentate e noi andiamo alle urne sicuri che la minaccia o l'inganno non possono alterare il nostro giudizio o influire sulla nostra volontà. La tolleranza e un civile costume di vita ci hanno risparmiato molti dolori. Sono passati cinque anni dall'ultima convocazione, e io penso soprattutto alle ore difficili che abbiamo vissuto insieme. Non ci sono stati risparmiati né i contrasti degli uomini né le sciagure provocate dalla natura, abbiamo sofferto la minaccia della guerra e affrontato una grave crisi della nostra economia. Ho avanti agli occhi le tristi immagini delle città e dei campi invasi dalle acque, le strade di Firenze trasformate in canali[1], le più alte testimonianze della nostra civiltà umiliate dal fango; e cosi lo sgomento della gente di Sicilia[2], i morti e le macerie, i poveri villaggi che attendevano ancora il riscatto dall'antica miseria e che hanno subito anche la furia del terremoto. ",1968
document_131164.html,[Gruppo parlamentare Dc della Camera]. Il Segretario politico della D.C. onorevole Aldo Moro concludendo il dibattito al Gruppo Parlamentare della Camera ha detto che questa serie di riunioni è stata utile perché ha consentito di cogliere le varie sensibilità di uomini responsabili della Democrazia Cristiana in questo particolare momento.,1963
document_121029.html,"[La solidarietà sociale. I principi dei rapporti civili]. [L’onorevole Moro] Dichiara[1] di non vedere in questo articolo i pericoli che sono stati riscontrati da altri oratori. Avverte che l’onorevole Dossetti[2] e lui vorrebbero che l’articolo, fosse chiarificato.",1951
document_110106.html,"[Circolare, 15 giugno 1944]. La fiducia di S. Em. il Card. Luigi Lavitrano[1], Arcivescovo di Palermo e Presidente della Commissione Cardinalizia per l’alta direzione dell’A.C.I., mi ha chiamato a riprendere, in via del tutto provvisoria, finché i contatti col Centro Nazionale non siano ripristinati, la direzione delle Associazioni Universitarie Cattoliche dell’Italia non occupata. Io mi auguro, per il bene della Fuci, che questo mio lavoro duri poco e che la Presidenza Centrale possa riprendere al più presto una normale attività. Ma perché questo mio augurio non sia inteso in senso difforme dal vero, devo subito aggiungere che torno al mio vecchio posto di responsabilità con entusiasmo e con gioia, dolente soltanto che le",1946
document_122012.html,"Montecitorio. La situazione nel Polesine. Le incompatibilità parlamentari. In questa settimana parlamentare sono venuti in discussione in assemblea plenaria due problemi di notevole importanza politica e cioè la situazione nel Polesine[1] e le incompatibilità parlamentari. La discussione sul primo argomento è stata promossa mediante presentazione di una mozione dell’on. Nenni[2]. In essa si chiede che l’opera di ricostruzione «venga sottratta alle remore dell’ordinaria amministrazione», che si provveda di urgenza all’attuazione di un organico piano di ricostruzione, che si accelerino le procedure dirette all’accertamento ed alla liquidazione dei danni.",1958
document_131046.html,"[Discorso a Latina]. Cari amici, premetto che io non intendo fare un discorso politico, per doveroso riguardo al Consiglio nazionale del Partito, che fra non molto sarà chiamato a stabilire la piattaforma elettorale della Democrazia Cristiana. E quindi in questo momento mi limiterò a dire cose che mi auguro non siano controverse e quindi non debbano passare al vaglio del Consiglio nazionale. ",1963
document_110099.html,"Dignità. Si è molto parlato e si parla dell’avvenire dell’Italia. Mentre si è tutti concordi nel voler ricostruire, non si sa poi bene da che punto quest’opera di restaurazione della patria vinta debba incominciare e si oscilla tra un pessimismo sfiduciato e stanco ed un ottimismo precipitoso e pericoloso. Questa mancanza di idee chiare, questo sentimento discontinuo, questa stanchezza diffusa arrestano purtroppo lo slancio di ripresa del popolo italiano, il quale stenta a ritrovare se stesso. Riconosciamo che oggi in Italia si crede poco in definitiva al valore della nostra vita nazionale ed al suo domani.",1946
document_110166.html,"Osservatorio 3. Da qualche tempo si discute in Italia di vera e di falsa democrazia e di solito nella polemica entrambi i contradittori sono convinti di essere in possesso della vera e di combattere negli altri una falsa democrazia. Ora, a parte la considerazione di merito, il più delle volte questa posizione tradisce una mentalità affatto democratica, ché democrazia è essenzialmente rispetto della libertà di tutti, della dignità di tutti, del dolore di tutti. Ed è – s’intende bene – una comodissima scusa, questa che libera dell’onere di tale rispetto sotto pretesto che altri non siano capaci o propensi a fare un gioco leale. Si tratta chiaramente di settarismo che si difende ed offende nel nome della libertà e nega quindi quest’ultima, servendosene come maschera del proprio esclusivismo, veramente illiberale.",1946
document_131146.html,"[Congresso delle Donne rurali]. Il Segretario politico della DC, on. Aldo Moro, intervenendo al Congresso delle donne rurali, ha espresso il suo vivo apprezzamento per il lavoro che la Coltivatori Diretti ha svolto e svolge mobilitando in un’azione unitaria ed efficace le varie categorie del mondo agricolo come è testimoniato, dopo l’imponente manifestazione dedicata ai giovani[1], da quella ora riservata alle donne. La DC – ha detto l’on. Moro – è consapevole dell’importanza che la donna ha nella vita familiare ed extra familiare dove porta la sua sensibilità ed intelligenza, il suo profondo equilibrio, il contributo di una sincera adesione ai valori spirituali e morali.",1963
document_132027.html,"Discorso ai Coltivatori diretti. Cari amici, il mio discorso sarà breve, perché ho un altro inderogabile impegno che mi attende, perché non vorrei stancarvi e perché su tutti i temi così interessanti che sono stati sollevati dal vostro presidente nel corso della sua relazione, parlerà domani, il ministro dell'Agricoltura, l'amico Ferrari Aggradi[1], che ha, con piena fiducia del Governo, tutte le responsabilità di questo importantissimo settore della vita economica nazionale. lo prendo la parola accogliendo il gentile invito del vostro presidente, che in questa veste e in altre mi ha sempre indirizzato nel corso delle tante vostre manifestazioni alle quali sono intervenuto. Quindi la mia presenza qui è innanzi tutto espressione della piena considerazione che io ho per la grande organizzazione dei Coltivatori diretti e della cordiale amicizia e riconoscenza che mi lega a voi, amici coltivatori, a tutti i vostri dirigenti, all'amico Bonomi[2], della cui attività infaticabile e generosa, io desidero dare atto anche in questo momento. Quindi non è soltanto una consuetudine, una tradizione che mi ha portato qui, anche se questa tradizione non doveva essere interrotta; ma è anche un personale e schietto sentimento di amicizia e di riconoscenza per voi, cari amici, per la vostra azione importante, fatta di spirito di sacrificio, piena di senso di responsabilità, azione generosa e utile, svolta in tutti questi anni (ormai un ventennio è dietro le nostre spalle), svolta in tutti questi anni sul terreno economico e sociale e, in definitiva, anche a vigoroso sostegno degli ideali di libertà, per i quali è nata l'Italia democratica alla cui costruzione insieme abbiamo dato il nostro contributo. ",1968
