doc_id,text,publication_date
document_121112.html,"[Aspetti della nuova costituzione. Relazione dell’on. Prof. Aldo Moro]. Di fronte alla richiesta, da alcune parti avanzata, che la Costituzione dovesse astrarre da ogni considerazione di carattere ideologico, ed essere in un certo senso neutra, i deputati della Democrazia Cristiana hanno affermato il principio che la Costituzione non può non avere uno sfondo ideologico e non rispecchiare il carattere cristiano del popolo italiano. In questa richiesta sapevamo di interpretare non solo il mandato ad essi conferito esplicitamente dai propri elettori, ma anche la diffusa aspirazione di tutti i cattolici italiani al di sopra delle eventuali divergenze politiche.",1951
document_132040.html,"Discorso alla direzione nazionale della Dc . Il Presidente del Consiglio incaricato on. Moro, nel suo intervento alla Direzione della Dc, ha ringraziato vivamente il segretario politico on. Rumor per il cordiale augurio rivoltogli anche a nome della Direzione centrale e per la solidarietà che gli è stata ancora una volta manifestata dagli amici della Dc. Ha aggiunto che egli si accinge a svolgere l’onorifico e difficile incarico conferitogli dal Capo dello Stato con senso del dovere, impegno e lealtà, avendo presente il valore politico della coalizione che è stata in linea di principio confermata dai partiti, i quali hanno aperto la nuova prospettiva politica per rendere più sicura, più piena e più concreta la libertà in Italia.",1968
document_110018.html,"Serenità. Il precipitare degli avvenimenti politici europei verso una nuova guerra, esplosa proprio alla vigilia del Congresso di Roma, non ha impedito che la Fucitenesse anche quest’anno il suo Congresso Nazionale. Sono state tagliate via, nettamente, senza inutili rimpianti, le esuberanze goliardiche, pur tanto care al nostro cuore; ma il Congresso è stato tenuto, tra la meraviglia un po’ compatente di qualcuno che sembrava non comprendere che cosa significasse, in quell’ora di dolore, un’adunanza di studenti universitari. Ma noi, che il Congresso abbiamo vissuto ogni giorno, in tutte le sue manifestazioni, quest’anno, con una maggiore serietà e pensosità, non sembravamo affatto meravigliati di trovarci riuniti, noi, piccola oasi di pace, in un mondo in subbuglio. Era per noi troppo naturale che, proprio in quell’ora che invitava ad una meditazione più profonda, che aveva un richiamo particolarmente insistente alle idee che spiegano la vita in tutte le sue vicende non sempre liete, si sentisse il bisogno di raccogliere insieme le nostre esperienze culturali e spirituali. Per cercare di capire insieme, nell’aiuto della luce infinita, l’intrigo di questo mondo, che sarebbe così facilmente chiarito nel piano delle idee e risolto in una superiore armonia in quello della realtà, solo che si avesse riguardo a certi fondamentali valori della vita, ai principii supremi che la Chiesa, depositaria della verità, addita al mondo convulso come generatori di pace e di soddisfazione per tutti. Per sentirci più forti, così insieme, nella Fede che rischiara l’avvenire anche il più fosco e dà serenità alla vita in qualsiasi contingenza. Ed eravamo appunto sereni, tra tanta inquietudine, per questa magnifica grazia della Fede che ci sorreggeva con maggior vigore in quel momento di crisi.",1946
document_141128.html,"[Brindisi in onore del ministro degli Esteri sovietico Gromyko]. mi è gradito rinnovarLe, anche a nome del Governo italiano, il più cordiale saluto e l’espressione della nostra sincera soddisfazione per questa Sua seconda visita ufficiale in Italia[2].",1973
document_141042.html,"La mozione del gruppo “Amici dell’on. Moro”. I Gruppi degli amici dell’onorevole Moro, della Base, di Forze Nuove e di Nuova Sinistra uniti nella battaglia congressuale intendono sviluppare insieme l’iniziativa per la formazione di una nuova maggioranza capace di adeguare l’azione della D.C. alle esigenze della società italiana e del momento storico, così come essi le hanno concordemente delineate.",1973
document_142227.html,"[La scomparsa di Giorgio La Pira]. « Scompare con La Pira[1] una delle personalità più affascinanti e più significative del mondo cattolico italiano e soprattutto di quello impegnato sul terreno sociale e politico. Rigorosamente coerente alla sua fede cristiana, e democratico convinto, uomo di cultura e di intuizione, ma di straordinaria semplicità, militante politico appassionato e non conformista, nella Democrazia Cristiana Giorgio La Pira ha legato il suo nome all’amministrazione, ricca di tensione ideale, dell’amata città di Firenze, all’insegnamento impartito in forme molteplici e con una vitale partecipazione, ad un impegno politico tutto caratterizzato da grandi prove morali e civili, alla causa della solidarietà nel nostro popolo e tra tutti i popoli del mondo. Fu quello della pace il suo pensiero dominante e la sua irriducibile speranza. Quel che Giorgio La Pira ha detto e fatto rimane nella realtà italiana di oggi e rimarrà nella storia del Paese ».",1978
document_142024.html," [Al Consiglio ministeriale della Nato ] .  « Vi sono zone geografiche nelle quali la crisi è acuta », ha detto il Ministro italiano. « Le condizioni di sicurezza e di stabilità che si cerca di consolidare in Europa non trovano, purtroppo, il loro corrispettivo in Medio Oriente . La preoccupazione del governo italiano è dovuta non soltanto alla vicinanza dell’ Italia alla zona di tensione, ma anche alla consapevolezza dei pericoli che questa situazione fa correre al processo di normalizzazione della vita internazionale. La posizione della regione del conflitto, che è al crocevia di tre continenti (e l’ Africa è oggi direttamente implicata), e l’uso, in una misura e con effetti imprevedibili, dell’arma del petrolio, rendono evidenti le pericolose ripercussioni mondiali della crisi. Vi possono essere tra gli alleati, e ciò è comprensibile, sensibilità diverse. Ma noi abbiamo certamente in comune la volontà di pace e l’intenzione che l’equilibrio mondiale non sia messo in pericolo, con i gravi effetti che ciò comporterebbe per la situazione internazionale e sul processo di distensione. ",1978
document_132228.html,"Discorso tenuto a Firenze per il XX anniversario della Confederazione del commercio . sono grato delle gentili parole di saluto che mi sono state rivolte e che ricambio con tutto il cuore. Mi è gradito partecipare a questo incontro, destinato a celebrare un proficuo ventennio di intensa attività sindacale ed insieme lo sforzo meritorio e fecondo della grande famiglia degli operatori commerciali. E sono lieto che esso si volga a Firenze, fra straordinarie opere d’arte e fervide testimonianze di cultura, dove un popolo toccato dalla sventura[2] mostra di saper coraggiosamente risollevarsi, trovando, nelle tradizioni di cui è custode e nel lavoro di cui è capace, la fede nell’avvenire.",1968
document_141127.html,"[Discorso in occasione della celebrazione in Campidoglio del XXV anniversario delle Nazioni Unite]. La celebrazione, proprio nell’augusta sede del Campidoglio, del XXV° anniversario delle Nazioni Unite[1], sottolinea la vocazione universale di Roma e dell’Italia. Ricordiamo infatti l’emergere, dalle rovine della guerra, di una organizzazione che esprime il comune destino dell’umanità ed afferma la legge di giustizia, di ordine e di pace, sulla quale deve fondarsi la convivenza sociale a livello mondiale. Le Nazioni Unite costituiscono il foro nel quale tutti i popoli si raccolgono liberi ed eguali per loro inalienabile diritto e, di più, nella loro concreta esperienza storica. Non v’è tribuna più alta dalla quale si possa parlare. Non v’è, fino ad oggi, un grado più elevato di attuazione del principio dell’indipendenza ed interdipendenza degli uomini e dei popoli. Vi sono evidentemente dei limiti posti all’autorità ed efficacia dell’organizzazione mondiale. Sono le angustie di ogni esperienza umana. Certo ingiustizie ed oppressioni persistono e vari conflitti continuano ad insanguinare il mondo, costituendo anche focolai di più vaste e pericolose conflagrazioni.",1973
document_121035.html,"[Il diritto di sciopero. I principi dei rapporti sociali (economici)]. [L’onorevole Moro] Ritiene[1] che si debba dare corso, per ora, alla discussione, salvo poi a riprendere in esame la sospensiva proposta dall’onorevole Lucifero[2], quando la discussione avrà chiarito il parere dei commissari in ordine a una materica così grave e delicata. ",1951
document_131034.html,"[Discorso alle donne D.C.]. L’on. Moro ha esordito recando il suo saluto alle donne democratiche cristiane ed esprimendo il suo vivo apprezzamento per l’iniziativa in corso e per l’opera efficace di formazione sociale e politica che il Movimento femminile compie nei riguardi delle donne italiane. La constatazione della vitalità del Movimento, della sua influenza sull’elettorato femminile, della sua autorità in seno al Partito è del resto il segno della sensibilità della D.C. per i problemi della donna nella comunità nazionale. Alla soluzione di questi problemi, all’assicurazione dell’apporto d’intelligenza, di sensibilità, di equilibrio della donna alla vita sociale, è impegnata la D.C. nella sua responsabilità di partito guida della democrazia italiana.",1963
document_142055.html," [La cooperazione con l’ Iraq ] .  « Mi è gradito ricordare, a questo proposito, i tecnici e lavoratori italiani che hanno contribuito alla realizzazione di importanti progetti per lo sviluppo dell’ Iraq , e che, confortati dalla vostra amichevole ospitalità, hanno trovato nel suo Paese una seconda patria. Essi sono i migliori testimoni, con il loro apporto di umanità e di esperienza, dell’amicizia fra i nostri due popoli. D’altra parte, abbiamo apprezzato la simpatia e la comprensione per le esigenze dell’ Italia , di cui l’ Iraq ha dato prova anche di recente in numerose occasioni. ",1978
document_110174.html,"Osservatorio 1. In un articolo pubblicato su «Domenica» del 29 aprile con il titolo: «Che cosa vuole la democrazia cristiana?», Giuseppe Sala[1] dice cose interessanti e di viva attualità intorno alla posizione delle forze cristiane in questo tormentato momento di storia[2]. In sostanza l’A. delinea un conflitto tra correnti conservatrici e correnti progressiste, orientate le prime verso la Chiesa, considerata come una istituzione di garanzia dell’ordine costituito, indirizzate le altre verso una concezione dinamica che scorge «nell’insegnamento di Cristo un continuo mordente rivoluzionario in un’ansia di perfettibilità e di rinnovamento». Come conseguenza di queste premesse i rapporti con il mondo del laicismo sono diversi, caratterizzati nel primo caso da intransigenza, intolleranza, incomprensione, nel secondo «da un’ardente curiosità e da una continua “mano tesa” verso le più opposte e lontane sponde».",1946
document_110127.html,"Tragico panorama di vita romana. Roma è tra le pochissime città italiane lasciate quasi intatte dalla guerra. Questa è forse la prima impressione di chi vi ritorna dopo il lungo distacco; ed è un’impressione mista di soddisfazione e di accoramento per il richiamo, così naturale, a tante rovine che questa salvezza così limitata, così eccezionale, così assurda perfino determina. Roma dunque è salva, almeno nella sua struttura esterna, in un’Italia distrutta. E sembra come una disposizione provvidenziale, la quale abbia lasciato integro il centro spirituale e politico della nostra vita di nazione, per facilitare la rinascita.",1946
document_141220.html,"[Dichiarazione al termine della riunione dei ministri degli Esteri dei “Dieci”]. La terza conferenza dei ministri degli esteri dei «dieci» si è svolta il 6 novembre 1971 a Bracciano, nella stupenda cornice del castello trecentesco degli Odescalchi, presenti le delegazioni dei “sei” Paesi del MEC e dei quattro membri candidati, cioè Gran Bretagna, Norvegia, Danimarca e Irlanda.",1973
document_141088.html,"Risposta al brindisi del ministro degli Esteri turco Çağlayangil. desidero esprimere a V.E. i più sentiti ringraziamenti per l’ospitalità offertami dal Governo di questo grande Paese amico ed alleato. I colloqui che ho avuto questo pomeriggio con il Presidente della Repubblica turca[2], col Primo Ministro[3] e con Lei, mi hanno promesso di confrontare i punti di vista italiani e turchi sulle principali questioni internazionali e di approfondire i problemi di comune interesse.",1973
document_141101.html,"[Discorso a Foggia in vista delle amministrative]. Il Ministro degli Esteri, on. Aldo Moro, parlando a Foggia per la campagna elettorale ha sottolineato il significato di profondo rinnovamento che assume l’ordinamento regionale. In tal modo la gestione della cosa pubblica potrebbe e dovrebbe divenire migliore, più libera cioè e più responsabile.",1973
document_142014.html," [Intervista al quotidiano Le Monde] .  » Certes, il faut toujours rechercher une meilleure compréhension réciproque. Pour tirer tout le parti possible des aspirations et des perspectives d’avenir qui nous sont communes, un long chemin reste à parcourir. Dans le domaine de la Communauté en particulier, même si une dialectique est naturelle et nécessaire, il faut faire en sorte qu’elle s’exerce, pour ainsi dire, en dehors des idéologies et sur le terrain des choix concrets qui se présentent au fur et à mesure. Il faut qu’un système de référence européen ayant sa force d’attraction propre, s’impose de plus en plus, prenant la place des positions nationales simplement raccordées pour des raisons d’opportunité. ",1978
document_131170.html,"[Stupore e cordoglio in tutto il Paese]. Come cristiani e come democratici esprimiamo il nostro vivissimo dolore per la notizia che ci ha profondamente colpiti dell’assurdo e criminoso attentato al Presidente Kennedy[1]. La sua figura di politico, sia nell’ambito del suo grande Paese, sia sulla scena internazionale, è andata ingigantendosi in questi anni di politica coraggiosamente rinnovatrice. La ragione per la quale è stato follemente colpito innalza ancora di più il Presidente Kennedy sul piano morale, come un grande difensore della dignità e della uguaglianza degli uomini.",1963
document_110050.html,Regalità di Cristo. A fondamento della Regalità di Cristo c’è un atto di amore: la creazione; c’è ancora un atto che è suprema espressione di amore: la redenzione; il potere regale dell’Uomo-Dio è su la vita generata per amore e per amore riportata al suo essere vero smarrito.,1946
document_132274.html,"Discorso tenuto a Livorno in occasione del giuramento dei cadetti . Sono molto lieto di essere ancora una volta tra voi, insieme con il ministro Tremelloni[1] che con tante dignità presiede al Ministero della Difesa, in occasione della inaugurazione dell’anno accademico e della riapertura dell’Istituto di guerra marittima. È una cerimonia assai significativa la quale culmina nel giuramento che voi, allievi Ufficiali, siete oggi chiamati a prestare. Esso infatti vi impegnerà per tutta la vita ed in modo particolarmente intenso a servizio della Patria e delle sue Istituzioni.",1968
document_132003.html,"Replica alla Camera al dibattito sulla fiducia al governo. ringrazio vivamente gli oratori intervenuti nel dibattito serrato ma sereno e in tutto degno, per il suo livello ed il suo tono, di questa Assemblea e dell'importante e delicato momento politico che il paese attraversa. È appunto alle esigenze e difficoltà che questo momento presenta, che questo Governo si sforza di corrispondere e, ritengo, possa in effetti corrispondere, pur essendo evidenti gli ostacoli di ogni ordine che esso dovrà affrontare e superare. Il vostro dibattito, onorevoli colleghi, è stato appunto rivolto a mettere in luce le caratteristiche, le ragioni di crisi, i problemi della situazione politica italiana, per misurare, secondo diversi criteri di giudizio, l'idoneità del mezzo posto in opera, attraverso la costituzione del Governo, per rispondere a queste esigenze e risolvere, mediante una determinata collaborazione politica ed un significativo programma, i problemi che urgono in Italiain questo momento storico. ",1968
document_141110.html,Risposta al brindisi del ministro degli Esteri somalo. desidero innanzitutto ringraziarLa delle calorose espressioni che Ella ha avuto la cortesia di rivolgermi.,1973
document_110130.html,"La marcia della fame. La marcia della fame, già minacciata da qualche giorno, è dunque incominciata. Ed è incominciata in modo inatteso e caratteristico. Non la muta protesta di volti emaciati per le vie splendenti della capitale, ma l’attacco violento di una folla disperata ai mercati neri fioriti indisturbati nei diversi quartieri di Roma. Incontro esasperato e disordinato di gente misera con gente misera. Ancora una volta le vittime di una stessa situazione dolorosa si sono colpite a vicenda, mancando al vero bersaglio, se pure un bersaglio c’è, che, una volta individuato e preso di mira, possa sanare le piaghe di questa disgraziatissima Italia.",1946
document_142116.html, [Dichiarazioni per la radiotelevisione greca] .  L’ Italia accoglie con sentimenti particolarmente cordiali e amichevoli il Primo Ministro greco  [1]  in visita ufficiale a Roma . ,1978
document_142109.html," [Al Consiglio europeo ] .  « Questa riunione  – ha detto Moro nel discorso d’apertura –  cade in un momento di gravi difficoltà economiche, ma di rinnovate speranze sul futuro del processo di unificazione europea. Sul piano economico, l’ampiezza e la durata della recessione pongono alla maggioranza dei nostri paesi problemi urgenti che richiedono decisioni entro le prossime settimane. Sul piano politico, il massiccio voto dell’elettorato britannico a favore della permanenza nella Comunità  [1]  crea obiettivamente nuove aspettative nell’opinione pubblica europea che, a mio giudizio, dovremmo trovare il modo di non deludere ». ",1978
document_121241.html,"[Per la concessione di un assegno annuo a Maria Montessori (in Commissione)]. Non credo[1] di dovermi soffermare troppo a lungo per illustrare la portata di questa mia proposta di legge; anzi dovrei dire di questa nostra proposta di legge perché sono stato confortato dal consenso di altri 45 eminenti colleghi, alcuni dei quali membri di questa Commissione, comunque firmatari appartenenti a tutti i settori della Camera, proprio perché nell’atto di fare questa proposta di legge ho voluto che essa avesse il carattere di un largo riconoscimento nazionale ad una grande educatrice italiana, Maria Montessori[2], la quale, dopo aver lavorato alcuni anni in Italia, con risultati estremamente brillanti, nel campo della ricerca pedagogica applicata, dovette lasciare l’Italia data l’incomprensione del fascismo verso il suo metodo di educazione ispirato a criteri di libertà. La Montessori ha vissuto all’estero per tutti questi anni ed ancora adesso vive in Olanda mentre le scuole ispirate al metodo Montessori sono diffuse in tutto il mondo. È veramente doloroso constatare che l’Italia, paese che ha dato la nascita a Maria Montessori, abbia soltanto tre scuole ispirate al metodo Montessori, mentre nella Nigeria ve ne sono 400, nell’India migliaia e moltissime ne esistono nella stessa Inghilterra.",1951
document_141046.html,"[Favorire l’accordo con la Jugoslavia: intervento al Consiglio ministeriale della Cee]. è ormai quasi un anno che i negoziati fra la Comunità[2] e la Jugoslavia sono bloccati per la nota difficoltà di assicurare un conveniente sbocco alle carni bovine provenienti da quel Paese. Tale situazione preoccupa vivamente il mio Governo, così come ha preoccupato quelli che lo hanno preceduto.",1973
document_141231.html,"[Commemorazione di Mario Toscano]. Venti anni è durata – ininterrotta fino alla sua prematura scomparsa – la straordinaria associazione di Mario TOSCANO[1] con il nostro Ministero e, possiamo dire, con la politica estera italiana, in tutte le sue più importanti manifestazioni.",1973
document_110190.html,"Saluto. Da questo numero il Bollettino di Studium, amichevole collegamento tra i Laureati Cattolici, verrà spedito in tutta Italia. Questa ripresa di contatti, che furono così a lungo e dolorosamente impediti, ci riempie l’animo di gioia. Fino a poco tempo fa sembrava impossibile questo ritorno. Oggi esso è una consolante realtà. Tanto più consolante, perché i primi frammentari incontri che in questo faticoso inizio ci sono stati concessi, dimostrano che nulla è andato perduto di quella costruttiva comunione di vita che costituisce l’anima del nostro movimento. Anzi, si può dire che la lunga prova ha chiarito meglio a tutti noi la necessità e bontà di questa unione, mentre la tristezza dei tempi e l’urgenza di una restaurazione spirituale e culturale ne mostrano il significato sociale, il valore costruttivo per la vita del nostro Paese.",1946
document_132047.html,Dichiarazione alla televisione in occasione dell'indipendenza di Malta . Interprete dei sentimenti del popolo italiano desidero rivolgere al popolo maltese un fervido saluto augurale in occasione della proclamazione dell’indipendenza di Malta.,1968
document_121129.html,"Osservatorio 1 (aprile 1947). Ritorna in occasione dei lavori per la Costituzione, in tema di rapporti tra Stato e Chiesa e di organizzazione scolastica, la vecchia disputa sullo Stato laico. Ed è una disputa appassionata, nella quale vengono in considerazione elevati valori morali. Ma, comunque sia motivata e pur ammettendo la buona fede e la sincera preoccupazione morale dei sostenitori dello Stato laico, è certo che la tesi laicista in un quadro integrale di valori non può essere sostenuta. Essa riduce infatti lo Stato a mera entità giuridica, lo estrania dal flusso della storia, lo fa indifferente verso cose che assumono per gli uomini, nei quali si risolve lo Stato, straordinaria importanza. Uno Stato che ignori la religione o le religioni, che si limiti freddamente a garantire ad esse condizioni di libertà è tale che rifiuta un impegno morale che per i singoli si pone come inderogabile esigenza. È uno Stato che manca di cose essenziali all’uomo e che si pone per ciò stesso in qualche modo pericolosamente fuori dell’uomo. Con ciò non intendiamo indicare positivamente l’atteggiamento che ogni Stato deve assumere di fronte al fenomeno religioso (cosa delicatissima e storicamente variabile), ma intendiamo affermare che lo Stato non può sbarazzarsi della religione, per procedere nella sua strada, perché con ciò, sia esso pure il più liberale, si è fatto già lontano dall’uomo e non vibra più all’unisono con lo spirito umano.",1951
document_132053.html,"Discorso tenuto a Trento in occasione della commemorazione del decennale della morte di Alcide De Gasperi. Mi sento altamente onorato di dare, poiché me ne è stata offerta cortesemente l'opportunità, la mia adesione all' odierna commemorazione, promossa dalla Dc, di Alcide De Gasperi[1] nel decennale della sua morte. E sono sicuro di interpretare, partecipando a questa commossa rievocazione, il sentimento anche di coloro che con me collaborano oggi al governo della Nazione. Quel governo che egli seppe guidare con incomparabile autorità ed efficacia in uno dei momenti più difficili della storia d'Italia. Dalle rovine della guerra alla ricostruzione del Paese, dal disordine e dalla sfiducia ad un più organico, giusto assetto della comunità nazionale, dall'isolamento e dalla mortificazione della sconfitta alla parità di diritti ed alla feconda collaborazione internazionale, dalla oppressione della dittatura ai liberi ordinamenti di una moderna e stabile democrazia, dal ristagno economico ad un progressivo e continuo sviluppo secondo ideali di giustizia ogni giorno più ampiamente realizzati. Sicché il suo nome contrassegna un'epoca difficile e costruttiva della moderna storia d'Italia che fa da solida premessa all'ulteriore balzo in avanti che, nel ricordo di lui, il popolo italiano è ancora chiamato a fare sulla via della libertà, dell'uguaglianza dei diritti e della giustizia sociale. Un'opera alla quale la Dc è impegnata com'è impegnato questo governo, al quale essa dà efficace e consapevole sostegno in costruttiva collaborazione con altre forze democratiche. L'omaggio che io rendo nell'esercizio della funzione di governo che egli tenne fino quasi a dieci anni fa con eccezionale e personalissimo prestigio, è dunque nello spirito della continuità ed insieme dello sviluppo. ",1968
document_110220.html,"Invito al Congresso. Da ogni parte e con insistenza sempre maggiore si è richiesto in questi ultimi tempi che fosse promosso un incontro nazionale dei Laureati Cattolici. Il distacco dura ormai da troppo tempo, da quella estate del 1943, la quale sembra, per gli eventi che son seguiti veloci e decisivi, un’epoca tanto lontana. Il desiderio così espresso ci è sembrato tanto vivo e sincero, da poter superare agevolmente le molte difficoltà di ordine materiale che rendono ancor oggi difficile e scomodo l’incontro. La Segreteria Centrale dei Laureati si è indotta perciò a convocare a Roma, dal 3al 7 del prossimo gennaio, il Congresso Nazionale dei Laureati Cattolici e delle Unioni Professionali Cattoliche. Essa ha fiducia, ed anzi certezza, che la buona volontà così dimostrata riuscirà a rendere questa una manifestazione degna dell’importanza del Movimento e del difficile momento che la Patria vive. Il Centro nazionale dei Laureati invita perciò nel modo più caldo e cordiale gli amici di tutta Italia e chiede loro questa prova di attaccamento che valga a confortare per l’avvenire l’opera comune.",1946
