doc_id,text,publication_date
document_131147.html,"[Articolo per il «Corriere della Sera»]. La Democrazia Cristiana ha condotto questa campagna elettorale[1] riaffermando la continuità della sua politica. Lo ha fatto non per mera opportunità, ma per offrire un serio elemento di valutazione al corpo elettorale. È una continuità questa, s’intenda bene, che non riguarda una politica timida e di respiro limitato. Nella nostra azione di ieri e di oggi, non vi è dunque rinuncia alla novità, alla iniziativa, all’utile aderenza alla realtà sociale e politica in evoluzione. La continuità è nel movimento, ieri come oggi, ma in un movimento ordinato ed equilibrato che si svolga con la piena garanzia della libertà nelle sue molteplici manifestazioni. Per questo abbiamo assicurato ed intendiamo assicurare per l’avvenire il reale sviluppo economico e sociale del paese sulla base della libertà d’iniziativa e della solidarietà sociale e non alla stregua di chiusure classiste e di impostazioni collettivistiche. Il nostro programma dice chiaramente che non ci siamo trasformati per strada in un partito classista e collettivistica, che riteniamo sempre valida una concezione pluralistica, libera, mobile della società e che su questa base ci appare, non solo possibile, ma certo il massimo sviluppo della società italiana. Abbiamo perciò ripetuto nel modo più impegnativo che la nazionalizzazione della energia elettrica[2] è un provvedimento singolare, giustificato in vista del carattere condizionante del settore energetico nei confronti dell’intera vita economica e sociale, il che richiede in via eccezionale un completo accentramento di esso nella pubblica disponibilità. La regola invece della vita economica resta la libertà; la privata iniziativa è ancora naturalmente posta a base dello sviluppo. Ciò non significa naturalmente per noi un modo di tutelare particolari interessi, una battuta di arresto sulla via della giustizia.",1963
document_141093.html,"[Brindisi di risposta al ministro degli Esteri francese Schumann] . la tradizionale amicizia dei nostri paesi, la loro straordinaria somiglianza, la varietà dei loro contatti spirituali e culturali, sono temi obbligati di ogni incontro italo-francese e, come tali, rischiano di acquistare il grigiore del luogo comune. Ma la verità, anche se ripetuta mille volte, non è per questo meno vera. Tra Italia e Francia esistono, per usare una espressione moderna, rapporti speciali, legami privilegiati. Non credo esistano nel mondo due nazioni così intimamente vicine, così profondamente interdipendenti. Lo storico che si dedica alle nostre nazioni scopre, non appena abbandona la superficie, che le radici si intrecciano, si accavallano e si confondono come quelle di due grandi alberi sorti l’uno accanto all’altro. Scrivere la storia d’Italia senza scrivere quella di Francia, e viceversa, è praticamente impossibile. Non abbiamo mai cessato di influenzarci vicendevolmente, avendo in comune problemi ed esperienze, crisi e movimenti spirituali, rivoluzioni ed evoluzioni. Italiani e francesi parlano, sotto il profilo delle idee, una stessa lingua e non debbono mai tradurre la loro storia in termini vicendevolmente comprensibili. Di quali nazioni, ripeto, può dirsi altrettanto?",1973
document_142133.html, [Sui risultati del vertice di Rambouillet ] .  « Nel quadro dell’evoluzione in atto in tutta la situazione mondiale – ha dichiarato al termine del vertice di Rambouillet  [1]  il presidente del Consiglio italiano Moro – questa riunione acquista certo un significato e un’importanza particolari ». ,1978
document_110016.html,"Con il Papa. Che il XXV Congresso delle Associazioni Universitarie di Azione Cattolica sia tenuto in Roma, centro del mondo cristiano e sede del Vicario di Cristo, mi pare cosa piena di significato. E va subito notato che non il caso ha portato a questa scelta, ma una esatta valutazione del valore particolare che il Congresso avrebbe assunto in questo ambiente; valutazione che i dirigenti dell’Assemblea Federale hanno compiuta, facendosi interpreti dell’animo di tutti. Si è voluto il Congresso a Roma, per rendere omaggio devoto a S.S. Pio XII[1] nel primo difficile anno del Suo Pontificato, per tenere, prendendo occasione dal fausto inizio, la nostra assemblea nazionale nel centro vitale direttivo della Chiesa.",1946
document_132094.html,"Dichiarazione per l’arrivo a Roma del primo ministro britannico Harold Wilson. sono particolarmente lieto di porgere a Lei, alla Signora Wilson ed alle personalità che la accompagnano, il saluto più cordiale del Governo italiano e mio personale, e di esprimerle la nostra più sincera soddisfazione per questo incontro che abbiamo vivamente auspicato.",1968
document_141304.html,"[Discorso a Lecce in vista del congresso]. Ci sarebbero molte cose da dire, ma io non le dirò tutte, ne cercherò alcune, così come mi vengono in questo momento nello spirito, tra le tante che potrei richiamare, che sarebbe, anzi, obiettivamente utile richiamare in questo momento in cui comincia il grande dibattito della Democrazia Cristiana che coinvolgerà tutto il Paese, tutte le forze politiche.",1973
document_142040.html," [Commemorazione del presidente Franz Jonas ] .  Signor Presidente, onorevoli colleghi, il 24 aprile è scomparso Franz Jonas  [1]  , presidente dell’amica Repubblica d’ Austria . Il male inesorabile e crudele che lo aveva colpito non era riuscito ad impedirgli, tale era la tempra dell’uomo e la dimensione dello statista, fino all’estremo delle sue forze, lo scrupoloso esercizio della sua alta funzione. Nell’inchinarci commossi alla memoria di Franz Jonas , desideriamo innanzitutto ricordare le sue qualità umane. Franz Jonas era uno degli otto figli di un manovale di Vienna , e deve l’inizio della sua ascesa alla tenacia con la quale volle e seppe dedicarsi, da autodidatta, agli studi. Nella vita pubblica portò fermezza di convinzione politica e profondo senso del dovere, rendendo al suo paese grandi servizi, prima come sindacalista poi come borgomastro di Vienna , carica che ricoprì per 14 anni, infine come presidente della Repubblica dal 1965. ",1978
document_132241.html,"Resoconto del discorso tenuto a Messina per le elezioni regionali. Parlando a Messina a conclusione della campagna per la elezione dell’Assemblea regionale, il Presidente del Consiglio on. Aldo Moro ha sottolineato la responsabilità che assume il popolo italiano nella designazione della sua rappresentanza regionale e, per giunta, ad un anno soltanto dalla consultazione generale politica.",1968
document_142192.html,"Il bene non fa notizia ma c’è. Il bell’articolo di Goffredo Parise[1] sul «Corriere della Sera» di qualche giorno fa, un monito a tener conto della realtà, per quanto sgradevole essa sia, merita qualche osservazione. Fra tante cose giuste quest’acuta analisi contiene punti che giustificano una riserva e stimolano ad una presa di coscienza delle nostre responsabilità. ",1978
document_132169.html,"Discorso ad Aquisgrana nel corso della visita ufficiale in Germania. Se molti e fecondi sono i vincoli che, in ogni tempo, hanno collegato i nostri due Paesi, un legame più forte e costante ha unito nei secoli la romanità imperiale e Aquisgrana. È un legame che risale all'origine stessa della vostra città. In Aquisgrana, è, infatti, viva la memoria dell'opera che Carlo Magno seppe compiere, traendo i popoli europei dalla decadenza, che accompagna sempre il frazionamento e la discordia, per ridare loro quel vigore che l'Europa ha sempre trovato nella feconda unione delle sue genti e nella comunanza delle sue risorse. Nell'incoronazione romana, nell'artefice di quella prima rinascita umanistica e civile, noi possiamo vedere il simbolo del vincolo ideale che unisce la vostra città e l'antica città dei Cesari e dei Pontefici. Qui fu, dodici secoli or sono, il centro di un mondo unito che si reggeva su due pilastri fondamentali: l'ordinamento giuridico romano e la forza spirituale del cristianesimo promotore di sentimenti universali e di fraterna unione fra i popoli. Da tali ideali, che sono stati rappresentati nei secoli da Roma e da Aquisgrana, si è sviluppata col contributo di tutte le nazioni europee la nostra civiltà. Oggi, dopo le terribili esperienze della guerra, della nostra assurda discordia, questo patrimonio comune del nostro passato acquista una rinnovata forza creativa, ed Italia e Germania, attraverso una straordinaria rinascita, mostrano quanto esse possano ancora dare al progresso civile non solo con le loro realizzazioni economiche e sociali ma proprio gettando le basi di una moderna unità europea che rimane nostra alta meta comune. ",1968
document_122035.html,"[Sulla conferma in servizio dei professori non di ruolo nell’istruzione secondaria]. In sostanza[1], il progetto, modificato dagli emendamenti Lozza[2] e dall’ultimo emendamento proposto dal Presidente[3], comporta che sono confermati in linea di principio tutti gli abilitati e non abilitati, salvo che non possano conservare il posto che già occupavano. Nell’ordinanza ministeriale si dovrà stabilire il criterio in base al quale i provveditori provvederanno all’assegnazione dei posti. Inoltre, sono ammesse domande di abilitati i quali non abbiano partecipato alla precedente graduatoria. Di conseguenza la distinzione tra abilitati e non abilitati viene annullata. Resta solo per l’ammissione di nuove domande. Se accettiamo domande di abilitati, in base a quale criterio di giustizia possiamo impedire che il laureato con il massimo dei voti presenti anche lui la sua domanda?",1958
document_142135.html," [Al Consiglio nazionale della Dc ] .  Le elezioni del 15 giugno hanno introdotto grossi elementi di novità nella vita politica italiana. I partiti ne sono stati scossi. Anche quelli che hanno conseguito indiscutibili vantaggi, si sono trovati di fronte a molti e difficili interrogativi. Rotto il vecchio equilibrio, non se ne è ancora composto un altro. La Democrazia Cristiana in particolare è stata colpita dagli avvenimenti e non ha ancora ritrovato la sua collocazione appropriata nello schieramento politico italiano. Espressione di questo travaglio è stata la crisi di segreteria del luglio scorso, che ci ha visto divisi su talune valutazioni di giustizia e di opportunità  [1]  . L’on. Zaccagnini  [2]  , con il prestigio scaturente da una vita intemerata e da una lunga milizia per ideali cristiani e democratici, ha assunto, in un momento estremamente difficile, la Segreteria politica con il precipuo intento di assicurare una transizione ordinata e ragionevole verso il Congresso ed un definitivo assetto politico e programmatico del partito. ",1978
document_132215.html,Brindisi in onore del presidente dell'Urss Podgorny . a nome del Governo italiano e mio personale ho l’onore ed il piacere di darle il benvenuto nel nostro Paese. La Sua presenza a Roma conferma il continuo progredire delle relazioni amichevoli fra l’Italia e l’Unione Sovietica ed il reciproco desiderio di imprimere ad esse un sempre maggiore sviluppo.,1968
document_141063.html,"Intervento alla sessione ministeriale della Nato. nel celebrare, nell’aprile scorso, a Washington[2], il ventennio della nostra alleanza – la più ampia riunione di popoli che la storia ricordi – e nel riaffermarne la permanente validità, il Consiglio ha deliberato le direttive per la nostra azione, alle quali conviene dunque ispirare i nostri lavori.",1973
document_110025.html,"Tempo perduto. Nel numero 6 della Rivista «Segni dei Tempi» Paolo Bonatelli[1] dedica un corsivo polemico ad Azione Fucina[2]. La quale viene accusata di presumere di aver scoperto, con una buona dose di ingenuità, che sarebbero stati i neo-scolastici i primi a dimostrare che ogni problema filosofico sorge dal problema della vita[3]; e in particolare, tra i neo scolastici, A. Masnovo[4]. E su questa sciocca ingenuità di Azione Fucina il Bonatelli fa delle allegre risate, con l’aria di chi riprenda dei ragazzi saputelli. ",1946
document_141030.html,"Uscire dall’indifferenza. Un discorso dell’on. Colombo[1], uomo politico di primo piano e leader della corrente d’impegno democratico[2], è sempre un fatto interessante ed importante. A maggior ragione lo è quello pronunziato qualche giorno fa e che costituisce la piattaforma congressuale del raggruppamento, come si suole ancora chiamarlo, doroteo. È probabilmente per questo che «Il Popolo» non lo ha confinato nella «Tribuna del Congresso»[3] ma lo ha collocato in buona evidenza e con spazio adeguato nella prima pagina. Il discorso è assai articolato e complesso e non può quindi esserne dato un giudizio esauriente in una breve nota. Ci limiteremo perciò ad alcune osservazioni.",1973
document_141228.html,"Discorso all’Università di Damasco. sono particolarmente onorato, non solo come Ministro degli Affari Esteri d’Italia, ma anche come membro del mondo universitario italiano, di trovarmi oggi in questa Università, erede della grande tradizione culturale siriana, illustrata da uomini come lo storico Ibn Khaldoun[2], lo scienziato Ibn al Haytham[3], il poeta Al Jabal Badawi[4], il poeta e filosofo Abou el Ala el Maarri[5].",1973
document_132029.html,"Discorsi della campagna elettorale per il voto regionale in Friuli-Venezia Giulia. Il presidente del Consiglio, on. Moro, parlando a Gorizia nel corso della campagna elettorale per la regione Friuli-Venezia Giulia, ha messo in rilievo l’importanza della istituzione della nuova Regione a statuto speciale, realizzata mediante l’impegno politico dei governi di centrosinistra e in particolare della Dc che ha nella zona la maggior forza e la maggiore responsabilità. Si è venuti così incontro alle reali aspirazioni delle laboriose popolazioni della Regione e si è creato, con un motivato atto di fiducia nel loro indefettibile attaccamento alla patria, un nuovo vincolo pur nella riconosciuta autonomia, di unità nazionale.",1968
document_142016.html,"[Sul conflitto arabo-israeliano]. Signor Presidente[1], onorevoli senatori, è la quarta volta, nel breve tempo di una generazione, che il medio oriente è turbato dalla guerra[2]. Prima ancora di compiere una valutazione degli avvenimenti di questi giorni, desidero esprimere i nostri sentimenti di umana solidarietà per le popolazioni colpite. Insieme alle preoccupazioni di natura politica per la ripresa delle ostilità in un’area, in ogni senso, a noi tanto vicina, c’è il profondo sgomento e la pietà per i morti, i feriti, gli sradicati delle due parti in conflitto. Nei passi che abbiamo compiuto presso i belligeranti, ragioni politiche ed umanitarie hanno motivato la nostra richiesta di tregua e l’appello ad astenersi da ogni atto che possa coinvolgere più gravemente i popoli della regione. ",1978
document_110009.html,"Tra i libri. Prof. Stefano Riccio: Il delitto politico: rilievi critici al Codice e nuovi orientamenti internazionali. Ed. Jovene, Napoli, 1936. ",1946
document_141262.html,"[Discorso a Foggia in vista delle elezioni]. L’on. Moro, parlando a Foggia, ha rilevato che le elezioni del 7 maggio sono caratterizzate dall’esigenza di controbattere, mediante una netta indicazione democratica, le spinte anti-istituzionali, sempre latenti nello schieramento politico italiano ed ora fattesi più evidenti ed aggressive. Forze nuove o che si presentano in modo nuovo, manifestano impazienza e sfiducia nelle nostre istituzioni democratiche e si adoperano per abbatterle come un ostacolo alla realizzazione dell’assetto politico al quale si mira. Si vuole scompaginare lo schieramento democratico, si vuole battere la Democrazia Cristiana per avviare ad una vera involuzione autoritaria. Una pattuglia estremista, di cui si dovrà verificare la consistenza, condiziona ancor più il Partito Comunista nella sua critica al sistema e tende ad alterare nel profondo i dati della politica italiana[1]. Si tratta di dimostrare che questa contestazione non ha dalla sua parte né ragione né forza per prevalere e che le istituzioni democratiche restano il fondamento della pace politica e lo strumento necessario e sufficiente per il progresso sociale del paese.",1973
document_132097.html,"Lettera inviata al consiglio nazionale Dc . Il Presidente del Consiglio on. Moro esprime il proprio compiacimento per l’ampiezza e la profondità della discussione che si è sviluppata in seno al Consiglio Nazionale, dopo la fase preparatoria in seno alla apposita Commissione presieduta dall’avv. Morlinoe sulla base della organica ed interessante relazione del segretario politico on. Rumor.",1968
document_131033.html,"[I giovani e la scuola]. Cari amici, volentieri ho aderito all’invito che l’amico Destefanis[1] mi ha rivolto di partecipare a questo vostro convegno[2].",1963
document_131168.html,"[Incarico di formare il nuovo governo (novembre 1963]. Innanzitutto desidero ringraziare il Presidente della Repubblica[1] per l’onore che mi ha fatto conferendomi l’incarico di costituire il Governo; incarico che ho accettato con riserva e sullo svolgimento del quale, nelle sue fasi salienti, mi riprometto di riferire al Capo dello Stato.",1963
document_110129.html,"I difetti degli italiani. Dei difetti del popolo italiano si è occupato di recente Gabriele Pepe[1] su «Il Risorgimento Liberale», indicandone due: la mancanza di senso civico e la scarsa educazione politica[2]. Ed intanto quell’Autore, proponendosi di compiere una valutazione serena e, soprattutto, costruttiva, si schierava contro coloro che si mostrano così solleciti nell’attribuire al nostro popolo, ed al nostro soltanto, le colpe peggiori. Costume non nuovo e certo deprecabile, malgrado la nobiltà dell’intento morale che spesso lo determina, perché inclina a disperdere come vane l’energie necessarie alla ripresa nazionale.",1946
document_141076.html,"[Messaggio contro la discriminazione razziale]. La giornata internazionale per la eliminazione delle discriminazioni razziali viene ad assumere quest’anno, in cui ricorre il venticinquesimo anniversario della Nazioni Unite[1], un significato particolare. Il venticinquesimo anniversario ci offre infatti l’occasione per promuovere un rafforzamento delle Nazioni Unite e impegnare concretamente l’organizzazione nella creazione di un ordine internazionale integralmente fondato sui principi della Carta. Nella grande ricorrenza trova quindi un nuovo impulso morale la lotta che le Nazioni Unite stanno da anni svolgendo, in difesa dei principii statutari, contro tutte le forze di discriminazione razziale.",1973
document_142107.html," Per una ripresa dell’economia italiana .  Ci si aspetta per la seconda metà dell’anno il punto di svolta del ciclo. Prima negli Stati Uniti , poi in Germania e nelle altre maggiori economie industriali. I governi hanno oramai ovunque formulato programmi di espansione i cui effetti dovrebbero assommarsi a quelli prodotti da condizioni di maggior facilità nei mercati monetari e finanziari di tutto il mondo. Se è mancata, lo scorso anno, una linea comune tra i maggiori governi del mondo, tale da impedire lo scivolare della crisi petrolifera in una pesante depressione mondiale, ancora oggi le pur corrette decisioni dei singoli Paesi lasciano qualche dubbio per l’assenza di un coordinamento e di un aiuto internazionale. ",1978
document_141199.html,"Risposta al brindisi del ministro degli Esteri sovietico Gromyko. Le sono molto grato per le cordiali parole di benvenuto che Ella ha voluto rivolgermi. A mia volta Le esprimo la più sincera soddisfazione di potere, grazie al gentile invito del Governo sovietico, visitare il suo Paese ed esaminare con Lei e con altre illustri personalità i maggiori temi della politica internazionale.",1973
document_110061.html,"[Circolare, 10 marzo 1941]. La chiamata alle armi dei compagni universitari della classe del ’21[1] impone alla Fuci nuove responsabilità nell’opera che essa svolge di assistenza religiosa all’Università italiana. E innanzi tutto in relazione a coloro che fanno parte della nostra organizzazione. Molti Fucini compiono il loro servizio militare in città dove esistono sedi della Fuci; è superfluo raccomandare che le Associazioni e i Segretariati interessati offrano affettuosa ospitalità ai compagni, che potranno invitare alle loro adunanze o per i quali, ove sembri opportuno, potranno promuovere particolari iniziative. Da parte del Centro, non appena siano giunte le necessarie segnalazioni, non si mancherà di dare indicazioni precise che permettano di avvicinare i fucini militari nelle diverse sedi. Ma frattanto sarà bene non trascurare nessuna occasione opportuna per venire in contatto con questi che debbono sentire la fraternità fucina come cosa viva e operante. D’altra parte Associazioni e Segretariati continuino a mantenere il più possibile rapporti con i loro iscritti militari, cui riuscirà caro sentirsi ricordati, mentre questo contatto che continua con l’ambiente della Fuci varrà pure certamente a mantenere desta la sensibilità per quei valori religiosi che in questo ambiente appunto si è imparato ad amare. ",1946
document_110144.html,Statuto della dignità dei popoli. (dal messaggio natalizio[1] del santo Padre[2]) ,1946
document_131128.html,"[Dichiarazione alla TV canadese]. Il mio partito, la Democrazia Cristiana, considera il 1963 un anno particolarmente importante per lo sviluppo delle prospettive di pace nel mondo. Ci siamo lasciati alle spalle momenti difficili, a tratti addirittura drammatici. Questa esperienza ha posto tutte le Nazioni – governanti e popoli – davanti alla necessità di non lasciare nulla d’intentato che possa in qualche misura contribuire a rendere più tranquillo e sereno l’orizzonte internazionale. Noi auspichiamo perciò che le Nazioni Unite rappresentino sempre più il foro significativo dell’opinione pubblica mondiale ed un mezzo per raggiungere un assetto ordinato e veramente pacifico del mondo. Noi riteniamo che la via delle trattative e del negoziato costituisca l’unico mezzo per la composizione di ogni vertenza, ma pensiamo pure che la pace si fondi, per quanto riguarda l’occidente, sulla unità, sulla forza, sulla reciproca collaborazione dei Paesi dell’Alleanza Atlantica[1].",1963
document_110079.html,"Il nostro pane quotidiano. In un commento del 18 ottobre u.s. Radio Roma[1] ci dà amorevoli lezioni intorno alle responsabilità, al corso, agli obiettivi di questa guerra. Apprendiamo così che essa fu imposta a noi e da noi virilmente accettata, per l’impossibilità di risolvere altrimenti i nostri vitali problemi, quasi che non avessimo conquistato una immensa terra africana, ricca di infinite possibilità, con un sostanziale consenso dei nostri amici europei, che si limitarono ad una finta di reazione, al solo scopo di salvare il prestigio di una istituzione (frutto del sangue sparso da milioni di uomini su tutti i campi di battaglia di Europa) che rappresentava la formula, politicamente operante, della nuova solidarietà internazionale[2]. Quasi che non avessimo ottenuto della nostra conquista formale e solenne riconoscimento e stipulato un accordo da gentiluomini che ci dichiarava soddisfatti dell’ottenuto incremento delle nostre possibilità nazionali[3].",1946
document_132226.html,"Resoconto del discorso tenuto a Bari ad un convegno sulla programmazione economica . Desidero esprimere la mia fiducia nell'avvenire della Puglia, così fervida e lungimirante in ogni tempo nella sua iniziativa economica e così pronta oggi a cogliere le nuove opportunità offerte dal più ordinato e veloce ritmo di sviluppo che si va ora delineando. Pur rifuggendo da ogni pretesa di esclusività, sconveniente ed insostenibile, non si può non ricordare che per impulso della Democrazia Cristiana furono concepiti i primi piani pluriennali, destinati ad operare sì per settori, ma in un ragionevole lasso di tempo e quindi con criteri di maggiore organicità. E così pure non mancò nella Dc in tempi lontani il primo serio sforzo per collegare in una visione di insieme, in una utile e istruttiva previsione, le prospettive di sviluppo programmato di particolari settori economici[1]. Essa dunque non giunge impreparata alla scadenza di una vera programmazione nazionale e fa confluire in modo naturale e costruttivo la sua esperienza e passione con quelle degli altri partiti, per dotare il Paese del suo fondamentale strumento di sviluppo. È utile qui richiamare il valore politico di fondo del piano quinquennale approvato dalla Camera dopo un'attenta valutazione, destinata a verificarne l'attendibilità ed utilità[2]. Può ben darsi che qualche dato, qualche prospettiva di questa prima redazione, che ha operato la sintesi di un grande materiale di studio accumulato in un anno di lavoro, possano essere oggetto di discussione. ",1968
document_110074.html,"Problemi dell’Università. Tornano in tempi nuovi vecchi problemi e si ripropongono attuali e vivi: così quello dell’Università. Mentre cresce ogni giorno più il numero degli studenti iscritti, è evidente, d’altra parte, un allontanamento da essa come organismo spirituale e di cultura. I giovani ne vanno perdendo sempre più l’amore, forse anche neppure ne conoscono il vero volto; divenuti massa, né frequentano né studiano, e l’Università minaccia di degradarsi al rango di macchina che, una volta pagata la moneta delle tasse e girata la manovella dell’esame, offre il diploma bello e pronto per l’uso.",1946
